{
  "generated_at": "2026-04-16T12:43:49+00:00",
  "source": "scripts/build_registry.py",
  "summary": {
    "category_count": 15,
    "entry_count": 2,
    "real_template_count": 1,
    "scaffold_count": 1,
    "featured_count": 1,
    "preview_ready_count": 0
  },
  "categories": [
    {
      "id": "slides",
      "slug": "slides",
      "name": "Slides",
      "description": "Presentation and slide deck templates.",
      "category_state": "real-templates-present",
      "listing_visibility": "public",
      "sort_order": 100,
      "shared_family": "presentation",
      "bootstrap_source": null,
      "notes": [
        "This category currently contains at least one real template package."
      ],
      "entry_counts": {
        "total": 1,
        "real_templates": 1,
        "scaffolds": 0
      },
      "has_entries": true,
      "has_real_templates": true,
      "has_scaffolds": false,
      "category_route": "/categories/slides"
    },
    {
      "id": "reports",
      "slug": "reports",
      "name": "Reports",
      "description": "Report-style templates and the report-family scaffold.",
      "category_state": "scaffold-backed",
      "listing_visibility": "public",
      "sort_order": 200,
      "shared_family": "report-family",
      "bootstrap_source": "templates/reports/_scaffold",
      "notes": [
        "The category is intentionally scaffold-backed and does not yet contain a real report template."
      ],
      "entry_counts": {
        "total": 1,
        "real_templates": 0,
        "scaffolds": 1
      },
      "has_entries": true,
      "has_real_templates": false,
      "has_scaffolds": true,
      "category_route": "/categories/reports"
    },
    {
      "id": "articles",
      "slug": "articles",
      "name": "Articles",
      "description": "Article templates.",
      "category_state": "empty-placeholder",
      "listing_visibility": "public",
      "sort_order": 300,
      "shared_family": "report-family",
      "bootstrap_source": "templates/reports/_scaffold",
      "notes": [
        "This is an empty future category placeholder.",
        "Future article templates are expected to bootstrap from the report-family scaffold."
      ],
      "entry_counts": {
        "total": 0,
        "real_templates": 0,
        "scaffolds": 0
      },
      "has_entries": false,
      "has_real_templates": false,
      "has_scaffolds": false,
      "category_route": "/categories/articles"
    },
    {
      "id": "books",
      "slug": "books",
      "name": "Books",
      "description": "Book-length templates.",
      "category_state": "empty-placeholder",
      "listing_visibility": "public",
      "sort_order": 400,
      "shared_family": "report-family",
      "bootstrap_source": "templates/reports/_scaffold",
      "notes": [
        "This is an empty future category placeholder.",
        "Future book templates are expected to bootstrap from the report-family scaffold."
      ],
      "entry_counts": {
        "total": 0,
        "real_templates": 0,
        "scaffolds": 0
      },
      "has_entries": false,
      "has_real_templates": false,
      "has_scaffolds": false,
      "category_route": "/categories/books"
    },
    {
      "id": "theses",
      "slug": "theses",
      "name": "Theses",
      "description": "Thesis templates.",
      "category_state": "empty-placeholder",
      "listing_visibility": "public",
      "sort_order": 500,
      "shared_family": "report-family",
      "bootstrap_source": "templates/reports/_scaffold",
      "notes": [
        "This is an empty future category placeholder.",
        "Future thesis templates are expected to bootstrap from the report-family scaffold."
      ],
      "entry_counts": {
        "total": 0,
        "real_templates": 0,
        "scaffolds": 0
      },
      "has_entries": false,
      "has_real_templates": false,
      "has_scaffolds": false,
      "category_route": "/categories/theses"
    },
    {
      "id": "dissertations",
      "slug": "dissertations",
      "name": "Dissertations",
      "description": "Dissertation templates.",
      "category_state": "empty-placeholder",
      "listing_visibility": "public",
      "sort_order": 600,
      "shared_family": "report-family",
      "bootstrap_source": "templates/reports/_scaffold",
      "notes": [
        "This is an empty future category placeholder.",
        "Future dissertation templates are expected to bootstrap from the report-family scaffold."
      ],
      "entry_counts": {
        "total": 0,
        "real_templates": 0,
        "scaffolds": 0
      },
      "has_entries": false,
      "has_real_templates": false,
      "has_scaffolds": false,
      "category_route": "/categories/dissertations"
    },
    {
      "id": "cv",
      "slug": "cv",
      "name": "CV",
      "description": "Curriculum vitae templates.",
      "category_state": "empty-placeholder",
      "listing_visibility": "public",
      "sort_order": 700,
      "shared_family": null,
      "bootstrap_source": null,
      "notes": [
        "This is an empty future category placeholder."
      ],
      "entry_counts": {
        "total": 0,
        "real_templates": 0,
        "scaffolds": 0
      },
      "has_entries": false,
      "has_real_templates": false,
      "has_scaffolds": false,
      "category_route": "/categories/cv"
    },
    {
      "id": "resumes",
      "slug": "resumes",
      "name": "Resumes",
      "description": "Resume templates.",
      "category_state": "empty-placeholder",
      "listing_visibility": "public",
      "sort_order": 800,
      "shared_family": null,
      "bootstrap_source": null,
      "notes": [
        "This is an empty future category placeholder."
      ],
      "entry_counts": {
        "total": 0,
        "real_templates": 0,
        "scaffolds": 0
      },
      "has_entries": false,
      "has_real_templates": false,
      "has_scaffolds": false,
      "category_route": "/categories/resumes"
    },
    {
      "id": "letters",
      "slug": "letters",
      "name": "Letters",
      "description": "Letter and correspondence templates.",
      "category_state": "empty-placeholder",
      "listing_visibility": "public",
      "sort_order": 900,
      "shared_family": null,
      "bootstrap_source": null,
      "notes": [
        "This is an empty future category placeholder."
      ],
      "entry_counts": {
        "total": 0,
        "real_templates": 0,
        "scaffolds": 0
      },
      "has_entries": false,
      "has_real_templates": false,
      "has_scaffolds": false,
      "category_route": "/categories/letters"
    },
    {
      "id": "posters",
      "slug": "posters",
      "name": "Posters",
      "description": "Poster templates.",
      "category_state": "empty-placeholder",
      "listing_visibility": "public",
      "sort_order": 1000,
      "shared_family": null,
      "bootstrap_source": null,
      "notes": [
        "This is an empty future category placeholder."
      ],
      "entry_counts": {
        "total": 0,
        "real_templates": 0,
        "scaffolds": 0
      },
      "has_entries": false,
      "has_real_templates": false,
      "has_scaffolds": false,
      "category_route": "/categories/posters"
    },
    {
      "id": "handouts",
      "slug": "handouts",
      "name": "Handouts",
      "description": "Handout templates.",
      "category_state": "empty-placeholder",
      "listing_visibility": "public",
      "sort_order": 1100,
      "shared_family": null,
      "bootstrap_source": null,
      "notes": [
        "This is an empty future category placeholder."
      ],
      "entry_counts": {
        "total": 0,
        "real_templates": 0,
        "scaffolds": 0
      },
      "has_entries": false,
      "has_real_templates": false,
      "has_scaffolds": false,
      "category_route": "/categories/handouts"
    },
    {
      "id": "lecture-notes",
      "slug": "lecture-notes",
      "name": "Lecture Notes",
      "description": "Lecture note templates.",
      "category_state": "empty-placeholder",
      "listing_visibility": "public",
      "sort_order": 1200,
      "shared_family": "report-family",
      "bootstrap_source": "templates/reports/_scaffold",
      "notes": [
        "This is an empty future category placeholder.",
        "Future lecture-note templates are expected to bootstrap from the report-family scaffold."
      ],
      "entry_counts": {
        "total": 0,
        "real_templates": 0,
        "scaffolds": 0
      },
      "has_entries": false,
      "has_real_templates": false,
      "has_scaffolds": false,
      "category_route": "/categories/lecture-notes"
    },
    {
      "id": "assignments",
      "slug": "assignments",
      "name": "Assignments",
      "description": "Assignment templates.",
      "category_state": "empty-placeholder",
      "listing_visibility": "public",
      "sort_order": 1300,
      "shared_family": null,
      "bootstrap_source": null,
      "notes": [
        "This is an empty future category placeholder."
      ],
      "entry_counts": {
        "total": 0,
        "real_templates": 0,
        "scaffolds": 0
      },
      "has_entries": false,
      "has_real_templates": false,
      "has_scaffolds": false,
      "category_route": "/categories/assignments"
    },
    {
      "id": "journals",
      "slug": "journals",
      "name": "Journals",
      "description": "Journal-specific templates.",
      "category_state": "empty-placeholder",
      "listing_visibility": "public",
      "sort_order": 1400,
      "shared_family": null,
      "bootstrap_source": null,
      "notes": [
        "This is an empty future category placeholder."
      ],
      "entry_counts": {
        "total": 0,
        "real_templates": 0,
        "scaffolds": 0
      },
      "has_entries": false,
      "has_real_templates": false,
      "has_scaffolds": false,
      "category_route": "/categories/journals"
    },
    {
      "id": "misc",
      "slug": "misc",